{
  "openhook": "0.1",
  "id": "7c9e6679-7425-40de-944b-e07fc1f90ae7",
  "source": "copilot",
  "type": "tool.end",
  "time": "2026-02-23T10:16:05.456Z",
  "session_id": "gh_sess_xyz789",
  "data": {
    "tool_name": "Bash",
    "tool_call_id": "call_abc123",
    "status": "success",
    "duration_ms": 3200
  },
  "cwd": "/home/user/my-project"
}
